{
  "$schema": "https://json-schema.org/draft/2020-12/schema",
  "$id": "https://github.com/emstacho-su/g-tee-oh/packages/contracts/schemas/node-dump.schema.json",
  "title": "g-tee-oh node dump",
  "description": "A generic dump of solved nodes that tools/library-pack turns into the library format (R0.7, R2.8, O-26): the game configuration the nodes were solved for, the position pair, and per node the actions, then per hand the action frequencies and one expected value (EV) per action. Amounts in centi-big-blinds (cbb) are integers and EVs are in big blinds (bb). The rules a schema cannot express (frequencies summing to 1, one frequency and one EV per action, hand labels matching the hand space, no duplicate hands or tokens) live in src/node-dump.ts.",
  "type": "object",
  "additionalProperties": false,
  "required": ["schema_version", "source", "exported_at", "config", "position_pair", "hand_space", "nodes"],
  "properties": {
    "schema_version": {
      "type": "integer",
      "const": 1,
      "description": "The version of this dump schema; a reader rejects any other value."
    },
    "source": {
      "type": "string",
      "enum": ["reference", "own"],
      "description": "Where the nodes come from (A4 solution_source): imported as a reference, or solved by this project's engine."
    },
    "exported_at": {
      "$ref": "#/$defs/timestamp",
      "description": "When the dump was written."
    },
    "config": {
      "$ref": "#/$defs/game_config",
      "description": "The game configuration the nodes were solved for."
    },
    "config_id": {
      "$ref": "#/$defs/config_id",
      "description": "The identifier of the matching game_config row when the configuration is seeded, for example cfg_6_online_100 (O-112)."
    },
    "position_pair": {
      "$ref": "#/$defs/position_pair",
      "description": "The two positions the nodes belong to, out of position first."
    },
    "hand_space": {
      "type": "string",
      "enum": ["preflop_169", "postflop_1326"],
      "description": "How hands are labelled (A3 section 1): the 169 preflop classes such as AKs, or the 1326 card combinations such as AhKh."
    },
    "exploitability_pct_pot": {
      "type": "array",
      "description": "The exploitability the solve reached, in percent of the pot, one value per position in pair order when known.",
      "items": { "type": "number", "minimum": 0 }
    },
    "nodes": {
      "type": "array",
      "minItems": 1,
      "description": "The solved nodes, each with its actions and per-hand strategy.",
      "items": { "$ref": "#/$defs/node" }
    }
  },
  "$defs": {
    "game_config": {
      "type": "object",
      "description": "The game configuration the nodes were solved for (A4 game_config), with the stake as a label.",
      "additionalProperties": false,
      "required": ["format", "table_size", "stake_label", "depth_cbb", "straddle", "ante_cbb"],
      "properties": {
        "format": {
          "type": "string",
          "enum": ["online", "live"],
          "description": "Whether the game is an online or a live game, which decides the sizing conventions."
        },
        "table_size": {
          "type": "integer",
          "minimum": 2,
          "maximum": 9,
          "description": "How many seats the table has, from heads-up to nine-handed."
        },
        "stake_label": {
          "type": "string",
          "minLength": 1,
          "description": "The blinds as players name them, for example 0.5/1."
        },
        "depth_cbb": {
          "type": "integer",
          "minimum": 1,
          "description": "The effective stack depth in centi-big-blinds (cbb), so 10000 is one hundred big blinds."
        },
        "straddle": {
          "type": "boolean",
          "description": "True when a straddle is posted, which adds a forced bet after the big blind."
        },
        "ante_cbb": {
          "type": "integer",
          "minimum": 0,
          "description": "The ante each player posts in centi-big-blinds (cbb), zero when there is none (O-33)."
        }
      }
    },
    "config_id": {
      "type": "string",
      "pattern": "^cfg_[2-9]_(online|live)(_[a-z0-9]+)?_[0-9]+(cbb)?(_straddle)?(_ante[0-9]+)?$",
      "description": "A game_config identifier in gto-model's grammar (O-112, O-132): cfg_, the table size, the format, the stake slug unless it repeats the format, the depth in whole big blinds or as <n>cbb, then _straddle and _ante<cbb> when they apply, for example cfg_9_live_13_150."
    },
    "position_pair": {
      "type": "string",
      "pattern": "^(UTG|UTG1|UTG2|LJ|HJ|CO|BTN|SB|BB)-(UTG|UTG1|UTG2|LJ|HJ|CO|BTN|SB|BB)$",
      "description": "Two of the nine gto-model position names (UTG, UTG1, UTG2, LJ, HJ, CO, BTN, SB, BB) joined by a hyphen, out of position first, for example BB-BTN (O-132)."
    },
    "position": {
      "type": "string",
      "enum": ["UTG", "UTG1", "UTG2", "LJ", "HJ", "CO", "BTN", "SB", "BB"],
      "description": "One of the nine gto-model position names, for example BTN or UTG1 (O-132)."
    },
    "timestamp": {
      "type": "string",
      "pattern": "^[0-9]{4}-[0-9]{2}-[0-9]{2}T[0-9]{2}:[0-9]{2}:[0-9]{2}(\\.[0-9]{1,9})?Z$",
      "description": "A point in time in Coordinated Universal Time with the Z suffix, ISO 8601 (the pattern stands in for the date-time format)."
    },
    "node": {
      "type": "object",
      "description": "One decision point of the tree: who acts, what is in the pot, the actions available and the strategy per hand.",
      "additionalProperties": false,
      "required": ["node_key", "street", "board", "to_act", "pot_cbb", "stacks_cbb", "actions", "hands"],
      "properties": {
        "node_key": {
          "type": "string",
          "pattern": "^[a-z0-9_]+/[A-Z0-9]+-[A-Z0-9]+/\\S*$",
          "description": "The node key (A3 section 1): the configuration identifier, the position pair and the action line so far, separated by slashes, with an empty line at the root."
        },
        "street": {
          "type": "string",
          "enum": ["preflop", "flop", "turn", "river"],
          "description": "The street the node is on."
        },
        "board": {
          "type": "string",
          "pattern": "^(([2-9TJQKA][cdhs]){3,5})?$",
          "description": "The board cards dealt so far as rank then suit, empty before the flop."
        },
        "to_act": {
          "$ref": "#/$defs/position",
          "description": "The position that acts at this node."
        },
        "pot_cbb": {
          "type": "integer",
          "minimum": 0,
          "description": "The pot before the action at this node, in centi-big-blinds (cbb)."
        },
        "stacks_cbb": {
          "type": "array",
          "minItems": 2,
          "description": "The stack behind of each position in pair order, in centi-big-blinds (cbb).",
          "items": { "type": "integer", "minimum": 0 }
        },
        "actions": {
          "type": "array",
          "minItems": 1,
          "description": "The actions available at this node, in the order the frequencies and EVs follow.",
          "items": { "$ref": "#/$defs/action" }
        },
        "hands": {
          "type": "array",
          "minItems": 1,
          "description": "The strategy per hand at this node.",
          "items": { "$ref": "#/$defs/hand_strategy" }
        },
        "accuracy_pct_pot": {
          "type": "number",
          "minimum": 0,
          "description": "The solve's accuracy at this node in percent of the pot, which feeds the accuracy floor (O-22)."
        }
      }
    },
    "action": {
      "type": "object",
      "description": "One available action: its token and its size.",
      "additionalProperties": false,
      "required": ["token", "size_cbb"],
      "properties": {
        "token": {
          "type": "string",
          "pattern": "^(f|x|c|l|a|s[0-9]+|b[0-9]+|r[0-9]+)$",
          "description": "The action token: f fold, x check, c call, l limp, a all-in, s<n> straddle, b<n> bet and r<n> raise, with the size in centi-big-blinds (cbb) as n."
        },
        "size_cbb": {
          "type": "integer",
          "minimum": 0,
          "description": "The total wager the action puts in, in centi-big-blinds (cbb), zero for a fold or a check."
        }
      }
    },
    "hand_strategy": {
      "type": "object",
      "description": "The strategy of one hand at a node: how often it takes each action and what each action is worth.",
      "additionalProperties": false,
      "required": ["hand", "frequencies", "ev_bb"],
      "properties": {
        "hand": {
          "type": "string",
          "pattern": "^([2-9TJQKA]{2}[so]?|([2-9TJQKA][cdhs]){2})$",
          "description": "The hand label in the dump's hand space: a preflop class such as AKs or 72o, or two cards such as AhKh."
        },
        "reach": {
          "type": "array",
          "minItems": 2,
          "maxItems": 2,
          "description": "How likely each position holds the hand at this node, in pair order, between 0 and 1.",
          "items": { "type": "number", "minimum": 0, "maximum": 1 }
        },
        "frequencies": {
          "type": "array",
          "minItems": 1,
          "description": "How often the hand takes each action, in action order, between 0 and 1 and summing to 1.",
          "items": { "type": "number", "minimum": 0, "maximum": 1 }
        },
        "ev_bb": {
          "type": "array",
          "minItems": 1,
          "description": "The expected value (EV) of each action for the hand in big blinds (bb), in action order, one per action.",
          "items": { "type": "number" }
        }
      }
    }
  }
}
